{
  "schema": "sheetdiff/v1",
  "old": {
    "path": "tests\\fixtures\\budget_v1.xlsx",
    "sha256": "5fa96c4dbab8f1fc11e16e6785ed06e25fe02eeca16681aee151f58963ff4908"
  },
  "new": {
    "path": "tests\\fixtures\\budget_v2.xlsx",
    "sha256": "fd9d1b92a6d0d8b9e28266131046d7fdbaa717b81d11ef4e0e884c6548ecb3a6"
  },
  "summary": {
    "sheets_changed": 3,
    "cells_modified": 3,
    "cells_added": 33,
    "cells_removed": 8,
    "formulas_changed": 1,
    "formats_changed": 1,
    "rows_added": 11,
    "rows_removed": 3,
    "sheets_added": 1,
    "sheets_removed": 1
  },
  "sheets": [
    {
      "name": "不变表",
      "status": "unchanged",
      "changes": [],
      "row_changes": [],
      "context": [],
      "merged_old": [
        "A1:B2"
      ],
      "merged_new": [
        "A1:B2"
      ]
    },
    {
      "name": "历史表",
      "status": "removed",
      "changes": [
        {
          "cell": "A1",
          "old_cell": "A1",
          "new_cell": null,
          "column_name": null,
          "kind": "removed",
          "old": {
            "value": "历史项目",
            "formula": null,
            "formatted": "历史项目",
            "format": {
              "alignment": "horizontal=general;vertical=bottom;rotation=0;wrap=false;shrink=false;indent=0;relative_indent=0;justify_last=false;reading_order=0",
              "bold": "false",
              "fill": "none",
              "font": "Calibri",
              "font_color": "#000000",
              "font_size": "11",
              "font_strike": "false",
              "font_underline": "none",
              "italic": "false",
              "number_format": "General"
            }
          },
          "new": null,
          "row_change": true
        },
        {
          "cell": "B1",
          "old_cell": "B1",
          "new_cell": null,
          "column_name": null,
          "kind": "removed",
          "old": {
            "value": "归档预算",
            "formula": null,
            "formatted": "归档预算",
            "format": {
              "alignment": "horizontal=general;vertical=bottom;rotation=0;wrap=false;shrink=false;indent=0;relative_indent=0;justify_last=false;reading_order=0",
              "bold": "false",
              "fill": "none",
              "font": "Calibri",
              "font_color": "#000000",
              "font_size": "11",
              "font_strike": "false",
              "font_underline": "none",
              "italic": "false",
              "number_format": "General"
            }
          },
          "new": null,
          "row_change": true
        },
        {
          "cell": "A2",
          "old_cell": "A2",
          "new_cell": null,
          "column_name": null,
          "kind": "removed",
          "old": {
            "value": "已结束项目",
            "formula": null,
            "formatted": "已结束项目",
            "format": {
              "alignment": "horizontal=general;vertical=bottom;rotation=0;wrap=false;shrink=false;indent=0;relative_indent=0;justify_last=false;reading_order=0",
              "bold": "false",
              "fill": "none",
              "font": "Calibri",
              "font_color": "#000000",
              "font_size": "11",
              "font_strike": "false",
              "font_underline": "none",
              "italic": "false",
              "number_format": "General"
            }
          },
          "new": null,
          "row_change": true
        },
        {
          "cell": "B2",
          "old_cell": "B2",
          "new_cell": null,
          "column_name": null,
          "kind": "removed",
          "old": {
            "value": 1000.0,
            "formula": null,
            "formatted": "1000.0",
            "format": {
              "alignment": "horizontal=general;vertical=bottom;rotation=0;wrap=false;shrink=false;indent=0;relative_indent=0;justify_last=false;reading_order=0",
              "bold": "false",
              "fill": "none",
              "font": "Calibri",
              "font_color": "#000000",
              "font_size": "11",
              "font_strike": "false",
              "font_underline": "none",
              "italic": "false",
              "number_format": "General"
            }
          },
          "new": null,
          "row_change": true
        }
      ],
      "row_changes": [
        {
          "row": 1,
          "kind": "removed",
          "cells": {
            "0": {
              "value": "历史项目",
              "formula": null,
              "formatted": "历史项目",
              "format": {
                "alignment": "horizontal=general;vertical=bottom;rotation=0;wrap=false;shrink=false;indent=0;relative_indent=0;justify_last=false;reading_order=0",
                "bold": "false",
                "fill": "none",
                "font": "Calibri",
                "font_color": "#000000",
                "font_size": "11",
                "font_strike": "false",
                "font_underline": "none",
                "italic": "false",
                "number_format": "General"
              }
            },
            "1": {
              "value": "归档预算",
              "formula": null,
              "formatted": "归档预算",
              "format": {
                "alignment": "horizontal=general;vertical=bottom;rotation=0;wrap=false;shrink=false;indent=0;relative_indent=0;justify_last=false;reading_order=0",
                "bold": "false",
                "fill": "none",
                "font": "Calibri",
                "font_color": "#000000",
                "font_size": "11",
                "font_strike": "false",
                "font_underline": "none",
                "italic": "false",
                "number_format": "General"
              }
            }
          }
        },
        {
          "row": 2,
          "kind": "removed",
          "cells": {
            "0": {
              "value": "已结束项目",
              "formula": null,
              "formatted": "已结束项目",
              "format": {
                "alignment": "horizontal=general;vertical=bottom;rotation=0;wrap=false;shrink=false;indent=0;relative_indent=0;justify_last=false;reading_order=0",
                "bold": "false",
                "fill": "none",
                "font": "Calibri",
                "font_color": "#000000",
                "font_size": "11",
                "font_strike": "false",
                "font_underline": "none",
                "italic": "false",
                "number_format": "General"
              }
            },
            "1": {
              "value": 1000.0,
              "formula": null,
              "formatted": "1000.0",
              "format": {
                "alignment": "horizontal=general;vertical=bottom;rotation=0;wrap=false;shrink=false;indent=0;relative_indent=0;justify_last=false;reading_order=0",
                "bold": "false",
                "fill": "none",
                "font": "Calibri",
                "font_color": "#000000",
                "font_size": "11",
                "font_strike": "false",
                "font_underline": "none",
                "italic": "false",
                "number_format": "General"
              }
            }
          }
        }
      ],
      "context": [],
      "merged_old": [],
      "merged_new": []
    },
    {
      "name": "新增表",
      "status": "added",
      "changes": [
        {
          "cell": "A1",
          "old_cell": null,
          "new_cell": "A1",
          "column_name": null,
          "kind": "added",
          "old": null,
          "new": {
            "value": "新项目 1",
            "formula": null,
            "formatted": "新项目 1",
            "format": {
              "alignment": "horizontal=general;vertical=bottom;rotation=0;wrap=false;shrink=false;indent=0;relative_indent=0;justify_last=false;reading_order=0",
              "bold": "false",
              "fill": "none",
              "font": "Calibri",
              "font_color": "#000000",
              "font_size": "11",
              "font_strike": "false",
              "font_underline": "none",
              "italic": "false",
              "number_format": "General"
            }
          },
          "row_change": true
        },
        {
          "cell": "B1",
          "old_cell": null,
          "new_cell": "B1",
          "column_name": null,
          "kind": "added",
          "old": null,
          "new": {
            "value": 100.0,
            "formula": null,
            "formatted": "100.0",
            "format": {
              "alignment": "horizontal=general;vertical=bottom;rotation=0;wrap=false;shrink=false;indent=0;relative_indent=0;justify_last=false;reading_order=0",
              "bold": "false",
              "fill": "none",
              "font": "Calibri",
              "font_color": "#000000",
              "font_size": "11",
              "font_strike": "false",
              "font_underline": "none",
              "italic": "false",
              "number_format": "General"
            }
          },
          "row_change": true
        },
        {
          "cell": "C1",
          "old_cell": null,
          "new_cell": "C1",
          "column_name": null,
          "kind": "added",
          "old": null,
          "new": {
            "value": "新增内容",
            "formula": null,
            "formatted": "新增内容",
            "format": {
              "alignment": "horizontal=general;vertical=bottom;rotation=0;wrap=false;shrink=false;indent=0;relative_indent=0;justify_last=false;reading_order=0",
              "bold": "false",
              "fill": "none",
              "font": "Calibri",
              "font_color": "#000000",
              "font_size": "11",
              "font_strike": "false",
              "font_underline": "none",
              "italic": "false",
              "number_format": "General"
            }
          },
          "row_change": true
        },
        {
          "cell": "A2",